{
  "$schema": "http://json-schema.org/draft-07/schema#",
  "$id": "urn:nansen:schema:table",
  "title": "NANSEN table sidecar",
  "description": "Describes one entity table stored as CSV: the column names and types, the key, and the fragment versions the columns follow. The sidecar alone is enough to read the CSV; no fragment definition or module code is needed.",
  "type": "object",
  "required": ["schemaType", "schemaVersion", "entityType", "file", "revision", "key", "columns"],
  "additionalProperties": false,
  "properties": {
    "$schema": { "type": "string" },
    "schemaType": { "const": "nansen.table" },
    "schemaVersion": { "type": "string", "pattern": "^0\\.1\\.\\d+$" },
    "entityType": { "type": "string", "pattern": "^[A-Za-z][A-Za-z0-9_]*$" },
    "file": {
      "type": "string",
      "pattern": "^[^/\\\\]+\\.csv$",
      "description": "File name of the CSV, in the same folder as the sidecar."
    },
    "revision": {
      "type": "integer",
      "description": "Save counter. A writer refuses to save when the revision on disk differs from the one it read (optimistic concurrency), and increments it on save."
    },
    "key": {
      "type": "array",
      "minItems": 1,
      "uniqueItems": true,
      "description": "Columns whose values together identify a row: the entity's identity and its ancestors' identity, outermost first.",
      "items": { "type": "string", "pattern": "^[A-Za-z][A-Za-z0-9_]*$" }
    },
    "columns": {
      "type": "array",
      "minItems": 1,
      "description": "Columns in the order they appear in the CSV header.",
      "items": { "$ref": "#/definitions/column" }
    },
    "fragments": {
      "type": "array",
      "description": "The fragments whose columns this table holds, and the version of each.",
      "items": { "$ref": "#/definitions/fragmentRef" }
    }
  },
  "definitions": {
    "column": {
      "type": "object",
      "required": ["name", "dataType"],
      "additionalProperties": false,
      "properties": {
        "name": { "type": "string", "pattern": "^[A-Za-z][A-Za-z0-9_]*$" },
        "dataType": { "type": "string", "enum": ["string", "integer", "number", "boolean", "date", "datetime"] },
        "fragment": {
          "type": "string",
          "pattern": "^[a-z][a-z0-9_]*(\\.[a-z][a-z0-9_]*)*$",
          "description": "Id of the fragment this column belongs to. Absent for key columns and other columns no fragment owns."
        },
        "unit": { "type": "string" },
        "description": { "type": "string" }
      }
    },
    "fragmentRef": {
      "type": "object",
      "required": ["id", "version"],
      "additionalProperties": false,
      "properties": {
        "id": { "type": "string", "pattern": "^[a-z][a-z0-9_]*(\\.[a-z][a-z0-9_]*)*$" },
        "version": { "type": "string", "pattern": "^\\d+\\.\\d+\\.\\d+$" }
      }
    }
  }
}
